{
 "title": "fixture world3d — 3D como capa del compositor",
 "style": "cosmos",
 "profile": "cinematic",
 "fps": 30,
 "width": 1280,
 "height": 720,
 "duration": 3,
 "handoffs": [],
 "shots": [
  {
   "id": "W1",
   "t": [0, 3],
   "size": "WS",
   "action": "mitad 2D plana, mitad capa world3d plana del mismo color (grano común); luego una esfera toon con contorno de tinta",
   "text": "",
   "cam": { "move": "static" },
   "transition_out": "cut"
  }
 ]
}
