{
 "title": "El sistema: proceso y arquitectura (diagramas estáticos)",
 "style": "soft",
 "medium": "tecnico_plano",
 "profile": "cinematic",
 "profileOverrides": {
  "shotLen": [
   4,
   20
  ],
  "maxHold": 8
 },
 "fps": 30,
 "width": 1920,
 "height": 1080,
 "duration": 40,
 "autoSfx": false,
 "music": null,
 "end_hold_ok": true,
 "shots": [
  {
   "id": "S01",
   "t": [
    0,
    8
   ],
   "size": "WS",
   "action": "pipeline de producción en snake: once etapas del brief a la nota del usuario",
   "text": "Pipeline de producción",
   "transition_out": "cut",
   "after": null,
   "cam": {
    "move": "static",
    "why": "reveal",
    "amount": 0
   },
   "hold_ok": [
    [
     5,
     8
    ]
   ]
  },
  {
   "id": "S02",
   "t": [
    8,
    16
   ],
   "size": "WS",
   "action": "ciclo 3DD: ocho pasos en bucle y dos lecciones reales",
   "text": "Ciclo 3DD: la nota cierra el bucle",
   "transition_out": "cut",
   "after": "S01",
   "cam": {
    "move": "static",
    "why": "reveal",
    "amount": 0
   },
   "hold_ok": [
    [
     6,
     8
    ]
   ]
  },
  {
   "id": "S03",
   "t": [
    16,
    24
   ],
   "size": "WS",
   "action": "arquitectura del motor: seis capas apiladas con sus módulos",
   "text": "Arquitectura del motor por capas",
   "transition_out": "cut",
   "after": "S02",
   "cam": {
    "move": "static",
    "why": "reveal",
    "amount": 0
   },
   "hold_ok": [
    [
     5,
     8
    ]
   ]
  }
 ]
}